{
  "schemaVersion": "1",
  "type": "scene",
  "id": "0",
  "title": "In the Quad at City University",
  "description": "It was a stark and dormy night.",
  "aspects": [
    {
      "name": "Stark and Dormy",
      "freeInvokes": 1
    },
    {
      "name": "Overgrown lawns and trash filled garden beds",
      "freeInvokes": 0
    }
  ],
  "characterIds": [ "0", "1" ]
}